### DISCUSSION TITLE
OIDC Login 502 Bad Gateway

### DISCUSSION THREAD

**Discussion by iali9906** [outline/outline#8741] [Self Hosting]
Hello,

I have a problem with keycloack authentication, which imrpovviso doesn't work, I've tried everything and can't come up with it.

I am experiencing the following errors:

```
{"attempt":0,"event":{"actorId":"a17ea4cb-7b1f-43fd-9b10-ca1e13a740bf","authType":"app","changes":null,"collectionId":"ee5ba633-1ff6-489f-a62c-d34ca9a3ace4","createdAt":"2025-03-21T12:04:13.135Z","data":{"title":"Sessione Di Verifica Abend: AGCXE & AGCXE2"},"documentId":"74a20cc1-f4a4-4cc4-ae61-0dd9d241a392","id":"380a5c24-6228-43c0-880e-ea2cbc8e577c","ip":"93.44.214.215","modelId":"388989b4-b952-46a7-8706-e59943f14730","name":"views.create","teamId":"3a2bb618-a815-4a39-bd74-d3befb6e378e","userId":null},"label":"worker","level":"info","message":"Processing views.create"}
{"event":{"actorId":"a17ea4cb-7b1f-43fd-9b10-ca1e13a740bf","authType":"app","changes":null,"collectionId":"ee5ba633-1ff6-489f-a62c-d34ca9a3ace4","createdAt":"2025-03-21T12:04:13.135Z","data":{"title":"Sessione Di Verifica Abend: AGCXE & AGCXE2"},"documentId":"74a20cc1-f4a4-4cc4-ae61-0dd9d241a392","id":"380a5c24-6228-43c0-880e-ea2cbc8e577c","ip":"93.44.214.215","modelId":"388989b4-b952-46a7-8706-e59943f14730","name":"views.create","teamId":"3a2bb618-a815-4a39-bd74-d3befb6e378e","userId":null},"label":"worker","level":"info","message":"WebhookProcessor running views.create"}
{"error":"request to https://login.company.it/auth/realms/company/protocol/openid-connect/token failed, reason: ","level":"error","message":"Error processing task in ValidateSSOAccessTask","stack":"BadRequestError: request to https://login.company.it/auth/realms/company/protocol/openid-connect/token failed, reason: \n    at InvalidRequestError (/opt/outline/build/server/errors.js:99:34)\n    at OIDCClient.rotateToken (/opt/outline/build/server/utils/oauth.js:69:45)\n    at process.processTicksAndRejections (node:internal/process/task_queues:95:5)\n    at async UserAuthentication.refreshAccessTokenIfNeeded (/opt/outline/build/server/models/UserAuthentication.js:120:24)\n    at async UserAuthentication.validateAccess (/opt/outline/build/server/models/UserAuthentication.js:68:7)\n    at async Promise.any (index 0)\n    at async /opt/outline/build/server/queues/tasks/ValidateSSOAccessTask.js:33:23\n    at async /opt/outline/node_modules/sequelize/lib/sequelize.js:507:18\n    at async ValidateSSOAccessTask.perform (/opt/outline/build/server/queues/tasks/ValidateSSOAccessTask.js:19:5)\n    at async Queue.<anonymous> (/opt/outline/build/server/services/worker.js:125:14)"}
{"label":"multiplayer","level":"debug","message":"2 connections to \"document.74a20cc1-f4a4-4cc4-ae61-0dd9d241a392\""}
{"label":"multiplayer","level":"info","message":"Closed connection to \"document.74a20cc1-f4a4-4cc4-ae61-0dd9d241a392\"","userId":"20e5561f-fb5b-42dc-9608-42968490d6cf"}
{"label":"multiplayer","level":"info","message":"New connection to \"document.74a20cc1-f4a4-4cc4-ae61-0dd9d241a392\""}
{"label":"multiplayer","level":"debug","message":"3 connections to \"document.74a20cc1-f4a4-4cc4-ae61-0dd9d241a392\""}
{"label":"multiplayer","level":"info","message":"Authenticated connection to \"document.74a20cc1-f4a4-4cc4-ae61-0dd9d241a392\""}
{"error":"State not return in OAuth flow","level":"error","message":"Error during authentication","stack":"BadRequestError: State not return in OAuth flow\n    at OAuthStateMismatchError (/opt/outline/build/server/errors.js:147:34)\n    at StateStore.verify (/opt/outline/build/server/utils/passport.js:46:61)\n    at OAuth2Strategy.authenticate (/opt/outline/node_modules/passport-oauth2/lib/strategy.js:222:26)\n    at _passportOauth.Strategy.authenticate (/opt/outline/build/plugins/oidc/server/auth/oidc.js:33:26)\n    at attempt (/opt/outline/node_modules/@outlinewiki/koa-passport/node_modules/passport/lib/middleware/authenticate.js:369:16)\n    at authenticate (/opt/outline/node_modules/@outlinewiki/koa-passport/node_modules/passport/lib/middleware/authenticate.js:370:7)\n    at /opt/outline/node_modules/@outlinewiki/koa-passport/lib/framework/koa.js:194:7\n    at new Promise (<anonymous>)\n    at /opt/outline/node_modules/@outlinewiki/koa-passport/lib/framework/koa.js:193:12\n    at /opt/outline/node_modules/@outlinewiki/koa-passport/lib/framework/koa.js:143:7\n    at new Promise (<anonymous>)\n    at passportAuthenticate (/opt/outline/node_modules/@outlinewiki/koa-passport/lib/framework/koa.js:107:15)\n    at passportMiddleware (/opt/outline/build/server/middlewares/passport.js:75:7)\n    at /opt/outline/node_modules/dd-trace/packages/datadog-instrumentations/src/koa.js:88:57\n    at passportMiddleware (/opt/outline/node_modules/dd-trace/packages/datadog-shimmer/src/shimmer.js:26:21)\n    at dispatch (/opt/outline/node_modules/koa-router/node_modules/koa-compose/index.js:44:32)\n    at next (/opt/outline/node_modules/koa-router/node_modules/koa-compose/index.js:45:18)\n    at /opt/outline/node_modules/koa-router/lib/router.js:346:16\n    at dispatch (/opt/outline/node_modules/koa-router/node_modules/koa-compose/index.js:44:32)\n    at next (/opt/outline/node_modules/koa-router/node_modules/koa-compose/index.js:45:18)\n    at /opt/outline/node_modules/@outlinewiki/koa-passport/lib/framework/koa.js:60:14\n    at process.processTicksAndRejections (node:internal/process/task_queues:95:5)"}
```

keycloack side I see that the authentication happens correctly:

```
14:39:05,314 DEBUG [org.keycloak.protocol.AuthorizationEndpointBase] (default task-475) Sent request to authz endpoint. Created new root authentication session with ID '8f8a29d2-6075-409f-8e48-cfb7504382b1' . Client: outline-prod-company . New authentication session tab ID: v6T4WtNZ44I
14:39:26,381 DEBUG [org.keycloak.services.resources.SessionCodeChecks] (default task-472) Will use client 'outline-prod-company' in back-to-application link
14:39:38,323 DEBUG [org.keycloak.services.resources.SessionCodeChecks] (default task-479) Will use client 'outline-prod-company' in back-to-application link
14:39:38,330 DEBUG [org.keycloak.events] (default task-479) type=LOGIN, realmId=company, clientId=outline-prod-company, userId=bff7ec82-6564-4802-b99b-9f9744660e91, ipAddress=101.56.219.173, auth_method=openid-connect, auth_type=code, selected_credential_id=605b61ff-4832-4714-8ae6-b5987c29134b, redirect_uri=https://docs.company.it/auth/oidc.callback, consent=no_consent_required, code_id=8f8a29d2-6075-409f-8e48-cfb7504382b1, username=testcompany, authSessionParentId=8f8a29d2-6075-409f-8e48-cfb7504382b1, authSessionTabId=v6T4WtNZ44I
```
I installed outline via docker compose about 1 year ago, tried to do update to latest, but nothing changed.
Below is the OIDC conf:
```
OIDC_CLIENT_ID=outline-prod-company
OIDC_CLIENT_SECRET=3333***2345
OIDC_AUTH_URI=https://login.company.it/auth/realms/company/protocol/openid-connect/auth
OIDC_TOKEN_URI=https://login.company.it/auth/realms/company/protocol/openid-connect/token
OIDC_USERINFO_URI=https://login.company.it/auth/realms/company/protocol/openid-connect/userinfo
#OIDC_USERNAME_CLAIM=uid
OIDC_DISABLE_REDIRECT=true
OIDC_DISPLAY_NAME=Company
OIDC_SCOPES=openid profile email
```

thanks

**Comment by tommoor** [comment]
The error is "State not return in OAuth flow", search the discussions as there are many possible causes due to the cookie being unreadable. e.g.

https://github.com/outline/outline/discussions/7584

**Reply by iali9906** [reply]
Hi, 
I have tried searching, but can't come up with it.
attached are the traefik reverse proxy logs, where it shows that in the call, the State cookie is returned but outline responds 502, I have not made any changes to either outline or reverse proxy.


I have the whole company locked down and we can't access the documentation.
I have tried both logging in with Microsoft Entra ID and Keycloak, but nothing changes the error is still the same.



[logs.json](https://github.com/user-attachments/files/19402470/logs.json)

**Comment by iali9906** [comment]
Hi @tommoor,

I think I've identified the problem, it seems that the Outline application is not using the configured system proxy when it needs to reach Keycloak, to validate or refresh tokens.

```
[root@icslvpl-expm-sv-01 infra]# docker exec -it --user root outline-prod-01 /bin/bash
root@f1f34cf4cebe:/opt/outline# tcpdump -nni any host login.company.it
tcpdump: data link type LINUX_SLL2
tcpdump: verbose output suppressed, use -v[v]... for full protocol decode
listening on any, link-type LINUX_SLL2 (Linux cooked v2), snapshot length 262144 bytes

17:40:28.724637 eth0  Out IP 172.18.0.12.47472 > 18.XXXXXX.443: Flags [S], seq 2984724310, win 32120, options [mss 1460,sackOK,TS val 3181799085 ecr 0,nop,wscale 7], length 0
17:40:28.975701 eth0  Out IP 172.18.0.12.56112 > 15.XXXXXX.443: Flags [S], seq 2560863219, win 32120, options [mss 1460,sackOK,TS val 2270869345 ecr 0,nop,wscale 7], length 0
17:40:29.226217 eth0  Out IP 172.18.0.12.59070 > 18.XXXXXX.443: Flags [S], seq 3454116393, win 32120, options [mss 1460,sackOK,TS val 402394416 ecr 0,nop,wscale 7], length 0
17:40:30.232053 eth0  Out IP 172.18.0.12.59070 > 18.XXXXXX.443: Flags [S], seq 3454116393, win 32120, options [mss 1460,sackOK,TS val 402395422 ecr 0,nop,wscale 7], length 0
17:40:32.280002 eth0  Out IP 172.18.0.12.59070 > 18.XXXXXX.443: Flags [S], seq 3454116393, win 32120, options [mss 1460,sackOK,TS val 402397470 ecr 0,nop,wscale 7], length 0
17:40:36.312003 eth0  Out IP 172.18.0.12.59070 > 18.XXXXXX.443: Flags [S], seq 3454116393, win 32120, options [mss 1460,sackOK,TS val 402401502 ecr 0,nop,wscale 7], length 0
17:40:38.740367 eth0  Out IP 172.18.0.12.58284 > 18.XXXXXX.443: Flags [S], seq 3000836373, win 32120, options [mss 1460,sackOK,TS val 3181809101 ecr 0,nop,wscale 7], length 0
17:40:38.991428 eth0  Out IP 172.18.0.12.56266 > 18.XXXXXX.443: Flags [S], seq 2014537420, win 32120, options [mss 1460,sackOK,TS val 402404181 ecr 0,nop,wscale 7], length 0
17:40:39.242675 eth0  Out IP 172.18.0.12.58724 > 15.XXXXXX.443: Flags [S], seq 73969246, win 32120, options [mss 1460,sackOK,TS val 2270879611 ecr 0,nop,wscale 7], length 0
17:40:40.280002 eth0  Out IP 172.18.0.12.58724 > 15.XXXXXX.443: Flags [S], seq 73969246, win 32120, options [mss 1460,sackOK,TS val 2270880649 ecr 0,nop,wscale 7], length 0
17:40:42.328978 eth0  Out IP 172.18.0.12.58724 > 15.XXXXXX.443: Flags [S], seq 73969246, win 32120, options [mss 1460,sackOK,TS val 2270882698 ecr 0,nop,wscale 7], length 0
17:40:44.824001 eth0  Out IP 172.18.0.12.59070 > 18.XXXXXX.443: Flags [S], seq 3454116393, win 32120, options [mss 1460,sackOK,TS val 402410014 ecr 0,nop,wscale 7], length 0
17:40:46.360199 eth0  Out IP 172.18.0.12.58724 > 15.XXXXXX.443: Flags [S], seq 73969246, win 32120, options [mss 1460,sackOK,TS val 2270886729 ecr 0,nop,wscale 7], length 0
17:40:54.551997 eth0  Out IP 172.18.0.12.58724 > 15.XXXXXX.443: Flags [S], seq 73969246, win 32120, options [mss 1460,sackOK,TS val 2270894921 ecr 0,nop,wscale 7], length 0
17:41:01.207995 eth0  Out IP 172.18.0.12.59070 > 18.XXXXXX.443: Flags [S], seq 3454116393, win 32120, options [mss 1460,sackOK,TS val 402426398 ecr 0,nop,wscale 7], length 0
17:41:10.936034 eth0  Out IP 172.18.0.12.58724 > 15.XXXXXX.443: Flags [S], seq 73969246, win 32120, options [mss 1460,sackOK,TS val 2270911305 ecr 0,nop,wscale 7], length 0
^C
16 packets captured
28 packets received by filter
0 packets dropped by kernel
```

As a result, Outline tries to contact KeyCloak directly, but lacking network openings (for this one has a proxy configured to go out to the Internet) the connection times out and consequently authentication fails with “Bad Gateway” message.

If a curl is tried instead, indeed the system proxy (10.140.9.132) is used and the connection works:

```
root@f1f34cf4cebe:/opt/outline# curl -vvv https://login.company.it
* Uses proxy env variable no_proxy == 'localhost,127.0.0.1'
* Uses proxy env variable https_proxy == 'http://10.140.9.132:3128'
*   Trying 10.140.9.132:3128...
* Connected to 10.140.9.132 (10.140.9.132) port 3128 (#0)
* allocate connect buffer
* Establish HTTP proxy tunnel to login.company.it:443
> CONNECT login.company.it:443 HTTP/1.1
> Host: login.company.it:443
> User-Agent: curl/7.88.1
> Proxy-Connection: Keep-Alive
>
< HTTP/1.1 200 Connection established
<
* CONNECT phase completed
* CONNECT tunnel established, response 200
* ALPN: offers h2,http/1.1
* TLSv1.3 (OUT), TLS handshake, Client hello (1):
*  CAfile: /etc/ssl/certs/ca-certificates.crt
*  CApath: /etc/ssl/certs
* TLSv1.3 (IN), TLS handshake, Server hello (2):
* TLSv1.2 (IN), TLS handshake, Certificate (11):
* TLSv1.2 (IN), TLS handshake, Server key exchange (12):
* TLSv1.2 (IN), TLS handshake, Server finished (14):
* TLSv1.2 (OUT), TLS handshake, Client key exchange (16):
* TLSv1.2 (OUT), TLS change cipher, Change cipher spec (1):
* TLSv1.2 (OUT), TLS handshake, Finished (20):
* TLSv1.2 (IN), TLS handshake, Finished (20):
* SSL connection using TLSv1.2 / ECDHE-RSA-AES128-GCM-SHA256
* ALPN: server accepted h2
* Server certificate:
*  subject: C=IT; L=Grassobbio; O=company S.p.A; CN=*.company.it
*  start date: Jul 19 00:00:00 2024 GMT
*  expire date: Aug 19 23:59:59 2025 GMT
*  subjectAltName: host "login.company.it" matched cert's "*.company.it"
*  issuer: C=US; O=DigiCert Inc; OU=www.digicert.com; CN=Thawte TLS RSA CA G1
*  SSL certificate verify ok.
* using HTTP/2
* h2h3 [:method: GET]
* h2h3 [:path: /]
* h2h3 [:scheme: https]
* h2h3 [:authority: login.company.it]
* h2h3 [user-agent: curl/7.88.1]
* h2h3 [accept: */*]
* Using Stream ID: 1 (easy handle 0x55ae56e55ce0)
> GET / HTTP/2
> Host: login.company.it
> user-agent: curl/7.88.1
> accept: */*
>
< HTTP/2 200
< date: Mon, 24 Mar 2025 16:47:13 GMT
< content-type: text/html
< content-length: 1087
< last-modified: Thu, 30 Jan 2020 13:50:31 GMT
< accept-ranges: bytes
<
<!--
  ~ Copyright 2016 Red Hat, Inc. and/or its affiliates
  ~ and other contributors as indicated by the @author tags.
  ~
  ~ Licensed under the Apache License, Version 2.0 (the "License");
  ~ you may not use this file except in compliance with the License.
  ~ You may obtain a copy of the License at
  ~
  ~ http://www.apache.org/licenses/LICENSE-2.0
  ~
  ~ Unless required by applicable law or agreed to in writing, software
  ~ distributed under the License is distributed on an "AS IS" BASIS,
  ~ WITHOUT WARRANTIES OR CONDITIONS OF ANY KIND, either express or implied.
  ~ See the License for the specific language governing permissions and
  ~ limitations under the License.
  -->
<!DOCTYPE html PUBLIC "-//W3C//DTD HTML 4.01 Transitional//EN">

<html>
<head>
    <meta http-equiv="refresh" content="0; url=/auth/" />
    <meta name="robots" content="noindex, nofollow">
    <script type="text/javascript">
        window.location.href = "/auth/"
    </script>
</head>
<body>
    If you are not redirected automatically, follow this <a href='/auth'>link</a>.
</body>
</html>
* Connection #0 to host 10.140.9.132 left intact

```

Before the migration of KeyCloak to AWS, everything worked because KeyCloak was on-prem and therefore did not need connectivity to the Internet.
To fix this problem, you have to configure the application to use the system proxy (which I would actually expect to happen automatically).

I have already entered the following variables in the .docker.env configuration file:

```
HTTP_PROXY="http://10.140.9.132:3128"
HTTPS_PROXY="http://10.140.9.132:3128"
NO_PROXY="localhost,127.0.0.1"
GLOBAL_AGENT_HTTP_PROXY=http://10.140.9.132:3128
GLOBAL_AGENT_HTTPS_PROXY=http://10.140.9.132:3128
```
but nothing has changed and I still can't use it, is it possible to make sure to force outline to use https and http proxy?

Thanks

**Comment by iali9906** [comment]
Hi @tommoor,

I saw that you have already created the pull request to fix the prbolematics.

Can you give me a release timeline?

Thanks
